J,"Seamans, TW; Blackwell, BF; Linnell, KE",,,,"Seamans, Thomas W.; Blackwell, Bradley F.; Linnell, Kimberly E.",,,Use of predator hair to enhance perceived risk to white-tailed deer in a foraging context,HUMAN-WILDLIFE INTERACTIONS,,,English,Review,,,,,,black bear; bobcat; Canis latrans; coyote; landscape of fear; Lynx rufus; Odocoileus virginianus; predation; Ursus americanus; white-tailed deer,ANTIPREDATOR BEHAVIOR; ODOCOILEUS-VIRGINIANUS; HABITAT SELECTION; BEAR PREDATION; UNITED-STATES; GROUP-SIZE; VIGILANCE; RESPONSES; ODORS; REPELLENTS,"Deer react to predator scent in varying degrees even when exposed to unknown predators. This response could be genetically based and maintained as long as the population is exposed to predation. We tested whether predator scent in the form of hair would enhance perceived risk and serve as a foraging repellent to free-ranging white-tailed deer (Odocoileus virginianus). During the winters of 2013 and 2014, we quantified alert behaviors and consumption of whole-kernel corn in response to current (coyote [Canis latrans]) and extirpated (bobcat [Lynx rufus]; black bear [Ursus americanus]) predator species alone and in combination with a partial visual barrier. Due to changes in herd dynamics and weather conditions, we did not compare results between years. We found enhanced alert behavior in all experiments except the 2014 exposure to coyote hair. Alert behaviors were heightened for about 4 days after hair placement. However, corn consumption was reduced only in the 2013 coyote-hair experiment. Our results suggest predator hair, when used alone and in conjunction with a form of visual barrier, can provide an element of protection from deer damage, but energetic needs will override the enhanced perceived risk caused by predator hair. Further work integrating complete visual barriers with predator hair is warranted.",,,,,,,,,,,,,,,,,,,,,,,FAL,2016,10,2,,,,,300,311,,,,,,,,Biodiversity & Conservation; Environmental Sciences & Ecology,,,,,,,2022-04-02,
J,"Alldredge, MW; Buderman, FE; Blecha, KA",,,,"Alldredge, Mathew W.; Buderman, Frances E.; Blecha, Kevin A.",,,Human-Cougar interactions in the wildland-urban interface of Colorado's front range,ECOLOGY AND EVOLUTION,,,English,Article,,,,,,aversive conditioning; Colorado; conflict; Cougar; domestic predation; human interaction; livestock; predation; Puma concolor; residential development; wildland-urban interface,HOME-RANGE; HABITAT SELECTION; LARGE CARNIVORE; BLACK BEARS; BEHAVIOR; POPULATION; MANAGEMENT; LANDSCAPE; PATTERNS; COYOTES,"As human populations continue to expand across the world, the need to understand and manage wildlife populations within the wildland-urban interface is becoming commonplace. This is especially true for large carnivores as these species are not always tolerated by the public and can pose a risk to human safety. Unfortunately, information on wildlife species within the wildland-urban interface is sparse, and knowledge from wildland ecosystems does not always translate well to human-dominated systems. Across western North America, cougars (Puma concolor) are routinely utilizing wildland-urban habitats while human use of these areas for homes and recreation is increasing. From 2007 to 2015, we studied cougar resource selection, human-cougar interaction, and cougar conflict management within the wildland-urban landscape of the northern Front Range in Colorado, USA. Resource selection of cougars within this landscape was typical of cougars in more remote settings but cougar interactions with humans tended to occur in locations cougars typically selected against, especially those in proximity to human structures. Within higher housing density areas, 83% of cougar use occurred at night, suggesting cougars generally avoided human activity by partitioning time. Only 24% of monitored cougars were reported for some type of conflict behavior but 39% of cougars sampled during feeding site investigations of GPS collar data were found to consume domestic prey items. Aversive conditioning was difficult to implement and generally ineffective for altering cougar behaviors but was thought to potentially have long-term benefits of reinforcing fear of humans in cougars within human-dominated areas experiencing little cougar hunting pressure. Cougars are able to exploit wildland-urban landscapes effectively, and conflict is relatively uncommon compared with the proportion of cougar use. Individual characteristics and behaviors of cougars within these areas are highly varied; therefore, conflict management is unique to each situation and should target individual behaviors. The ability of individual cougars to learn to exploit these environments with minimal human-cougar interactions suggests that maintaining older age structures, especially females, and providing a matrix of habitats, including large connected open-space areas, would be beneficial to cougars and effectively reduce the potential for conflict.",,,,,,,,,,,,,,,,,,,,,,,SEP,2019,9,18,,,,,10415,10431,,10.1002/ece3.5559,,AUG 2019,,,,Environmental Sciences & Ecology; Evolutionary Biology,,,,,,,2022-04-02,
J,"Tarakini, T; Mabika, I; Dakwa, F; Mundy, P; Fritz, H",,,,"Tarakini, Tawanda; Mabika, Innocent; Dakwa, Farisayi; Mundy, Peter; Fritz, Herve",,,Terrestrial threats dominate the waterbird landscape of fear in a savannah pan wetland system,WILDLIFE BIOLOGY,,,English,Article,,,,,,disturbances; escape; Hwange National Park; protected areas,HWANGE-NATIONAL-PARK; HUMAN DISTURBANCE; PREDATION RISK; PROTECTED AREAS; LIFE-HISTORY; VIGILANCE; BEHAVIOR; SIZE; WATERFOWL; RESPONSES,"Natural or anthropogenic disturbances (stimuli that trigger a behavioural response from animals) can have direct consequences on fitness and population trends. This study aimed at investigating the relative influence of three types of disturbances (mammalian herbivores, terrestrial threats from ground predators and aerial threats) on the responses by waterbirds at waterpans in Hwange National Park (HNP, Zimbabwe) and adjacent land uses. Thirteen waterpans were monitored during daylight hours between years 2015 and 2017 and responses of waterbirds to the three forms of disturbances were recorded. Logistic regressions revealed that the likelihood of responding was highest after terrestrial threats; with individuals/groups that were initially engaged in non-feeding activities that allowed vigilance, responding the most. Wildfowl species spent significantly longer time flying (compared to waders and generalists), more so in communal areas (CAs) than HNP, and after terrestrial threats compared to aerial threats and herbivore disturbances. We did not find any differences in probability of responding across land uses probably because there is less human disturbance in HNP, but predation risk is high. Further, even though there are less terrestrial predators in CAs, domestic dogs may be maintaining the stimuli. We conclude that terrestrial threats are least tolerated, with species most susceptible to human predation (i.e. wildfowl) losing more time avoiding them. Interestingly, only acute aerial threats induced departure from waterpans. Our findings have a direct implication for waterbird conservation as herbivore and human density in this area are currently increasing.",,,,,,,,,,,,,,,,,,,,,,,,2020,2020,2,,,,,,,wlb.00680,10.2981/wlb.00680,,,,,,Environmental Sciences & Ecology; Zoology,,,,,,,2022-04-02,
J,"Tran, DSC; Langel, KA; Thomas, MJ; Blumstein, DT",,,,"Tran, Diem Samantha C.; Langel, Katharine A.; Thomas, Madison J.; Blumstein, Daniel T.",,,Spearfishing-induced behavioral changes of an unharvested species inside and outside a marine protected area,CURRENT ZOOLOGY,,,English,Article,,,,,,fear; flight initiation distance; learning; marine protected area; spearfishing; starting distance,FLIGHT INITIATION DISTANCE; SENSITIVE PREDATOR AVOIDANCE; RISK-ASSESSMENT; BODY-SIZE; FEAR; CONSERVATION; PERCEPTION; ECOLOGY; TROUT; SEA,"By prohibiting fishing, marine protected areas (MPAs) provide a refuge for harvested species. Humans are often perceived as predators by prey and therefore respond fearfully to humans. Thus, fish responses to humans inside and outside of an MPA can provide insights into their perception of humans as a predatory threat. Previous studies have found differences in the distance that harvested species of fish initiate flight (flight initiation distance-FID) from humans inside and outside an MPA, but less is known about unharvested species. We focused on whether the lined bristletooth Ctenochaetus striatus, an unharvested surgeonfish, can discriminate between a snorkeler and a snorkeler with a spear gun inside and outside of a no-take MPA in Mo'orea, French Polynesia. Additionally, we incorporated starting distance (the distance between the person and prey at the start of an experimental approach), a variable that has been found to be important in assessing prey escape decisions in terrestrial species, but that has not been extensively studied in aquatic systems. Lined bristletooth FID was significantly greater in the presence of a spear gun and varied depending on if the spear gun encounter was inside or outside of the MPA. These results imply a degree of sophistication of fish antipredator behavior, generate questions as to how a nontargeted species of fish could acquire fear of humans, and demonstrate that behavioral surveys can provide insights about antipredator behavior.",,,,,,,,,,,,,,,,,,,,,,,FEB,2016,62,1,,,,,39,44,,10.1093/cz/zov006,,,,,,Zoology,,,,,,,2022-04-02,
J,"Banks, PB; Bryant, JV",,,,"Banks, Peter B.; Bryant, Jessica V.",,,Four-legged friend or foe? Dog walking displaces native birds from natural areas,BIOLOGY LETTERS,,,English,Article,,,,,,habituation; human disturbance; ecotourism; predation risk; domestic dog,ANTIPREDATOR BEHAVIOR; HUMAN DISTURBANCE; PERSISTENCE; HYPOTHESIS; PREDATORS,"Dog walking is among the world's most popular recreational activities, attracting millions of people to natural areas each year with diverse benefits to human and canine health. But conservation managers often ban dog walking from natural areas fearing that wildlife will see dogs as potential predators and abandon their natural habitats, resulting in outcry at the restricted access to public land. Arguments are passionate on both sides and debate has remained subjective and unresolved because experimental evidence of the ecological impacts of dog walking has been lacking. Here we show that dog walking in woodland leads to a 35% reduction in bird diversity and 41% reduction in abundance, both in areas where dog walking is common and where dogs are prohibited. These results argue against access by dog walkers to sensitive conservation areas.",,,,,,,,,,,,,,,,,,,,,,,DEC 22,2007,3,6,,,,,611,613,,10.1098/rsbl.2007.0374,,,,,,Life Sciences & Biomedicine - Other Topics; Environmental Sciences & Ecology; Evolutionary Biology,,,,,,,2022-04-02,
J,"Blank, DA",,,,"Blank, D. A.",,,Behavioral responses of goitered gazelles to potential threats,MAMMAL RESEARCH,,,English,Article,,,,,,Antipredator behavior; Escaping flight; Goitered gazelle; Predation risk; Predators; Prey risk assessment,PREDATION RISK; GROUP-SIZE; HABITAT SELECTION; TAILED DEER; RED DEER; VIGILANCE; PREY; RECOGNITION; BENEFITS; SIGNALS,"Prey species have to recognize a predator, assess its potential threat, and adjust its behavioral responses according to the magnitude of the perceived predation risk. In many studies of antipredator behavior in prey animals, simulated threats, such as human activities (movements, approaching prey), have been used as experimental threat factors, often in controlled circumstances, while prey responses to other animals in natural environments have been less investigated. This paper discusses the responses of goitered gazelles in the wild during encounters with various animals in their natural habitat to evaluate their cues used to assess the magnitude of potential threats. This study found that the goitered gazelles' behavioral responses to perceived risk differed across the various species sharing their habitat, with kulan recognized as a minimal threat and Siberian ibex the most threatening among ungulates. Among predators, the fox caused the least fear, while a horseman with a dog was identified as the greatest threat, with a wolf falling in between. Goitered gazelles adjusted their responses depending on the traits of the species encountered, while the features and conditions in their local environment played a less significant role. During encounters with other species, the gazelles ranked them according to their potential risk level based on the animal's appearance and behavior. The gazelles did distinguish between predators and other species and reacted to them differently: from pursuing and harassing the smallest (fox), to a panicky, running escape from their most dangerous natural predator (wolf), and especially from their most lethal, non-natural predator (herdsmen-mainly local poachers). Thus, this study suggested that goitered gazelles differentiate between predator species, assess their traits and intentions in each particular setting, and respond in the most advantageous way to each threat challenge.",,,,,,,,,,,,,,,,,,,,,,,JAN,2020,65,1,,,,,141,149,,10.1007/s13364-019-00457-y,,,,,,Zoology,,,,,,,2022-04-02,
J,"Ordiz, A; Bischof, R; Swenson, JE",,,,"Ordiz, Andres; Bischof, Richard; Swenson, Jon E.",,,"Saving large carnivores, but losing the apex predator?",BIOLOGICAL CONSERVATION,,,English,Article,,,,,,Behavior; Conservation; Ecological role; Hunting; Landscape of fear; Management,TROPHIC CASCADE; BROWN BEARS; MESOPREDATOR RELEASE; TOP PREDATORS; PREY; WOLVES; WOLF; CONSERVATION; FOREST; POPULATION,"Large terrestrial carnivores, e.g. wolves or bears, often play a key ecological role from their position at the apex of trophic systems. Changes to their populations reverberate through ecological communities; consequently their widespread decline in numbers and shrinking distribution due to human persecution has brought about a loss and reconfiguration of biological diversity in many systems. Although many large carnivore populations are now under conservation-minded management, political and economic constraints make compromises necessary. A common compromise is to permit limited harvests, with the premise of sustainability and the objective to increase tolerance and funding for carnivore recovery and conservation. Here we question whether a large carnivore that has to look over its shoulder for human hunters can still fully perform its ecological role at the apex of a trophic system. We use information about carnivore behavior, ecology, trophic interactions, and the effects of human exploitation to argue that exploitation of large carnivores, even if sustainable numerically, undermines the commonly expressed rationale for their conservation, namely the restoration and preservation of ecosystem functionality. Our argument centers around (i) the necessity of behavioral adjustments in large carnivores to anthropomorphic risk, which may limit their contribution to the landscape of fear, and (ii) the observation that many of the same features that put large carnivores at the apex of trophic systems also make them vulnerable to human exploitation and persecution, with implicit consequences for their ecological functionality and evolution. Although hunting large carnivores can improve public acceptance, managers must be aware of the trade-offs. (C) 2013 The Authors. Published by Elsevier Ltd. All rights reserved.",,,,,,,,,,,,,,,,,,,,,,,DEC,2013,168,,,,,,128,133,,10.1016/j.biocon.2013.09.024,,,,,,Biodiversity & Conservation; Environmental Sciences & Ecology,,,,,,,2022-04-02,
J,"Mathisen, KM; Wojcicki, A; Borowski, Z",,,,"Mathisen, Karen Marie; Wojcicki, Adam; Borowski, Zbigniew",,,Effects of forest roads on oak trees via cervid habitat use and browsing,FOREST ECOLOGY AND MANAGEMENT,,,English,Article,,,,,,Deer; Oak; Damage; Fear; Hunters; Edge,YELLOWSTONE-NATIONAL-PARK; PREDATION RISK; ROE DEER; BEHAVIORAL-RESPONSES; WOLVES; MOOSE; FEAR; ELK; LANDSCAPE; SELECTION,"Roads can affect animals in several ways, by affecting movement, space use, foraging behavior and mortality. As roads often have a negative effect on populations of birds and mammals, their effects are important for wildlife management. However, the effect of roads differ between different types of roads, and most studies of road ecology have focused on major roads with high traffic intensity, whilst effects of smaller unpaved forest roads in northern ecosystems are less known. We investigated the effects of forest roads in a mixed conifer forest in central Europe on cervid habitat use and browsing impact on forest regeneration during the winter season. We found that hunted cervid species avoided forest roads, and that browsing pressure was higher within the core of forest areas rather than close to roads. This led to an increased density of undamaged trees (by browsing) close to forest roads, whilst browsing damages were relatively high in the interior. Hunters often use these forest roads in the hunting season. We suggest that human disturbance creates corridors of fear along forest roads, and that cervids alter their habitat and browse use to avoid humans. This in turn has implications for forest and cervid management. This is the first study to document that gravel roads can affect oak trees through modifying cervid behavior. Future studies should use experiments to explore this question further and separate different effects of forest roads to understand the mechanisms; edge effects on vegetation, traffic, effects on natural predators and human disturbance.",,,,,,,,,,,,,,,,,,,,,,,SEP 15,2018,424,,,,,,378,386,,10.1016/j.foreco.2018.04.057,,,,,,Forestry,,,,,,,2022-04-02,
J,"Borowski, Z; Barton, K; Gil, W; Wojcicki, A; Pawlak, B",,,,"Borowski, Zbigniew; Barton, Kamil; Gil, Wojciech; Wojcicki, Adam; Pawlak, Bogdan",,,"Factors affecting deer pressure on forest regeneration: The roles of forest roads, visibility and forage availability",PEST MANAGEMENT SCIENCE,,,English,Article,,,,,,road; deer; landscape of fear; human footprint; browsing impact; habitat structure,PREDATION RISK; HABITAT USE; TEMPORAL SCALES; ROE DEER; RED; LANDSCAPE; RESPONSES; SELECTION; IMPACTS; WOLVES,"BACKGROUND Deer pressure on forest regeneration constitutes a serious problem in commercial forests in the northern hemisphere due to the increase in deer populations. However, other drivers, such as climate, landscape structure and the level of human activity, have a strong influence on deer pressure. The direct, density-related impacts of ungulates on forest regeneration have been well studied, but there is limited empirical evidence related to the indirect factors mentioned above. We conducted a field experiment in three forest divisions in Poland to evaluate the role of a common element of human infrastructure, i.e. small, unpaved forestry roads. Additionally, we assessed the modifying effect of visibility driven by vegetation cover and forage availability. RESULTS The proximity of unpaved roads affected deer habitat use and foraging behaviour, and limited browsing pressure on regenerating forests. Low visibility and higher winter forage availability increased the probability of tree browsing. We observed different responses to roads in two deer species: red deer avoided roads, while roe deer browsed in the vicinity of roads. CONCLUSIONS A typical forest network of unpaved roads creates a landscape of fear for red and roe deer, and limits browsing pressure on regenerating forests due to the changes in deer habitat use, activity patterns and foraging behaviour. Knowledge of the factors influencing browsing pressure can help to spatially optimise the application of protective measures for tree seedlings.",,,,,,,,,,,,,,,,,,,,,,,FEB,2021,77,2,,,,,628,634,,10.1002/ps.6207,,DEC 2020,,,,Agriculture; Entomology,,,,,,,2022-04-02,
J,"BLANCHARD, RJ; SHEPHERD, JK; RODGERS, RJ; MAGEE, L; BLANCHARD, DC",,,,"BLANCHARD, RJ; SHEPHERD, JK; RODGERS, RJ; MAGEE, L; BLANCHARD, DC",,,ATTENUATION OF ANTIPREDATOR DEFENSIVE BEHAVIOR IN RATS FOLLOWING CHRONIC TREATMENT WITH IMIPRAMINE,PSYCHOPHARMACOLOGY,,,English,Article,,,,,,IMIPRAMINE; ANTIPANIC; TRICYCLIC ANTIDEPRESSANT; CHRONIC TREATMENT; ANXIETY; DEFENSE; FEAR; RISK ASSESSMENT; ANIMAL MODEL; SEX DIFFERENCES,ANIMAL-MODEL; TRICYCLIC ANTIDEPRESSANTS; CONFLICT BEHAVIOR; ANXIETY DISORDERS; TEST BATTERY; DIAZEPAM; DRUGS; ALPRAZOLAM; ETHANOL,"The anxiety/defense test battery has been developed to assess defensive reactions in rats to situations associated with a natural predator, the domestic cat. This comprises three paradigms designed to study the effects of cat exposure on general activity and location with respect to the cat (proxemic avoidance), the effects of cat exposure on non-defensive consummatory behavior, and the behavioral response to cat odor. In the present study subjects were exposed to 21 days pretreatment with imipramine (0, 5, and 15 mg/kg), before being assessed in the three experimental paradigms (carried out over a total period of 7 days). Imipramine treatment was maintained on a daily basis during the 7 days taken to complete the series of tests. The data indicated a behaviorally specific profile consistent with anxiety/fear reduction, but not with sedation, in three different paradigms, following treatment with 15 mg/kg imipramine. These behavioral changes included a reduction in freezing, proxemic avoidance and a disinhibition of suppressed feeding in response to cat presentation. Similarly, imipramine treatment (15 mg/kg) significantly reduced behaviors associated with risk assessment (e.g. flat back approach, stretch attend) during presentation of a cat odor stimulus. This behavioral profile suggests that chronic pretreatment with imipramine produces an attenuation of antipredator defensive behavior.",,,,,,,,,,,,,,,,,,,,,,,JAN,1993,110,1-2,,,,,245,253,,10.1007/BF02246981,,,,,,Neurosciences & Neurology; Pharmacology & Pharmacy; Psychiatry,,,,,,,2022-04-02,
J,"Cabrera, D; Andres, D; McLoughlin, PD; Debeffe, L; Medill, SA; Wilson, AJ; Poissant, J",,,,"Cabrera, Doreen; Andres, Daniel; McLoughlin, Philip D.; Debeffe, Lucie; Medill, Sarah A.; Wilson, Alastair J.; Poissant, Jocelyn",,,Island tameness and the repeatability of flight initiation distance in a large herbivore,CANADIAN JOURNAL OF ZOOLOGY,,,English,Article,,,,,,boldness; Equus caballus; fear; horse; personality; risk aversion; temperament,LONG-TERM REPEATABILITY; ANTIPREDATOR BEHAVIOR; RURAL POPULATIONS; BODY CONDITION; LIFE-HISTORY; PERSONALITY; ECOLOGY; HUMANS; HORSES; PREDATION,"Antipredator behaviours can be lost relatively quickly in populations that are relieved of predation, as is known for several species inhabiting islands. Flight initiation distance (FID) is often studied in the context of island tameness; however, little is known about the factors that influence and maintain FID variation in predation-free populations. Here, we studied FID in foals of an isolated predator-free population of feral horses (Equus caballus L., 1758) on Sable Island, Canada, to determine if FID could be used for research on consistent individual differences in risk aversion and island tameness. In addition to testing for temporal, spatial, and sex effects on FID, we compared repeatability estimates at two temporal scales (within and among days). Similar FID for measurements obtained on the same day and for males and females indicated an absence of short-term desensitization and sex effects. In contrast, FID decreased for measurements made on subsequent days and from east to west, which could reflect habituation to human presence and (or) other temporal and spatial processes. Repeatability was high (0.42 +/- 0.06), but tended to decrease with increasing time intervals. This study highlights the potential of FID for individual-based research on the ecology and evolutionary dynamics of risk aversion in predation-free populations.",,,,,,,,,,,,,,,,,,,,,,,OCT,2017,95,10,,,,,771,778,,10.1139/cjz-2016-0305,,,,,,Zoology,,,,,,,2022-04-02,
