J,"Symons, J; Pirotta, E; Lusseau, D",,,,"Symons, John; Pirotta, Enrico; Lusseau, David",,,Sex differences in risk perception in deep-diving bottlenose dolphins leads to decreased foraging efficiency when exposed to human disturbance,JOURNAL OF APPLIED ECOLOGY,,,English,Article,,,,,,bioenergetics; consequences of disturbance; dive modelling; ecology of fear; PCOD; predation risk; Tursiops truncatus,BREATH-HOLD DIVERS; DOUBTFUL-SOUND; TURSIOPS-TRUNCATUS; NEW-ZEALAND; PATCHY ENVIRONMENT; PREDATION RISK; SIMPLE-MODEL; TOUR BOATS; BEHAVIOR; IMPACTS,"<list list-type=1 id=jpe12337-list-0001> Individuals make behavioural decisions by weighing potential advantages and costs (e.g. increased food intake vs. increased risk of predation). When animals change their activities in response to a perceived threat, their energetic input may decline. Marine ecotourism, including whale and dolphin watching, is growing globally and cetaceans perceive interactions with tour vessels as a form of risk. Observable behavioural changes need to be linked to bioenergetic effects to determine the potential population consequences of this disturbance. We developed a theoretical optimal dive model for bottlenose dolphins under three potential types of perceived risk resulting from human interactions at the surface (decreasing instantaneous risk, increasing instantaneous risk and no risk). We compared the predictions of these theoretical models to observed dive cycles of foraging male and female dolphins in the presence and absence of tour vessels. We used mixture models to classify dive types and mixed effects models to analyse changes in the interbreath interval of surface and bottom dives and the frequency of estimated bottom dives. Males significantly increased bottom time and performed fewer bottom dives when boats were present, matching predictions of our theoretical model for perceived decreasing instantaneous risk. In contrast, females significantly decreased bottom times and increased the frequency of bottom dives, matching predictions from the model for perceived increasing instantaneous risk. Therefore, our empirical results suggest differences in the perception of risk between sexes.Synthesis and applications. By comparing theoretical predictions with observed dive data, our study suggests that boat interactions during foraging can cause decreased net energy gain over a foraging bout for both sexes, with females being more impacted. The population under study is currently listed as critically endangered. Understanding whether these predicted energetic impacts affect an individual's vital rates will provide a link to the population-level consequences of this disturbance. Previous analytical approaches have failed to capture the costs associated with disturbance during foraging, leading to management recommendations that only protect animals from increased energetic expenditure. We suggest that the current management scheme should be revised to include foraging areas in order to secure the energy intake of animals. By comparing theoretical predictions with observed dive data, our study suggests that boat interactions during foraging can cause decreased net energy gain over a foraging bout for both sexes, with females being more impacted. The population under study is currently listed as critically endangered. Understanding whether these predicted energetic impacts affect an individual's vital rates will provide a link to the population-level consequences of this disturbance. Previous analytical approaches have failed to capture the costs associated with disturbance during foraging, leading to management recommendations that only protect animals from increased energetic expenditure. We suggest that the current management scheme should be revised to include foraging areas in order to secure the energy intake of animals.",,,,,,,,,,,,,,,,,,,,,,,DEC,2014,51,6,,,,,1584,1592,,10.1111/1365-2664.12337,,,,,,Biodiversity & Conservation; Environmental Sciences & Ecology,,,,,,,2022-04-02,
J,"Kuroda, K; Kameda, T",,,,"Kuroda, Kiri; Kameda, Tatsuya",,,"You watch my back, I'll watch yours: Emergence of collective risk monitoring through tacit coordination in human social foraging",EVOLUTION AND HUMAN BEHAVIOR,,,English,Article,,,,,,Coordination; Producer-scrounger game; Social foraging; Risk; Emotional arousal; Cognitive control,COGNITIVE LOAD; TRADE-OFF; TRUST; GAME; EXPECTATIONS; COOPERATION; EVOLUTION,"Predation risk is a significant concern when social animals including humans engage in foraging. When people search for resources together, individuals often find themselves in a producer-scrounger game, in which some individuals bear the cost of risk monitoring while others can free ride on those efforts. A theoretically rational strategy is to mix foraging and risk monitoring randomly with the same probability across all members, but such uncoordinated action often yields inefficiencies of under- or over-supply of risk monitoring in a group. Here, we examined whether people could spontaneously develop a coordinated risk-monitoring system, alternating vigilance and foraging in a pair. Given that human cooperation is vulnerable to fear of exploitation and emotional arousal under risk, we hypothesized that such sources of anxiety would be potential disruptors to coordination. In a laboratory experiment, two participants worked on a treasure hunt task simultaneously, in which they chose between low or high vigilance against predators during foraging without verbal communication. If one chose high vigilance with personal cost, it yielded a spillover benefit to the other. Besides behavioral choices, each participant's physiological arousal (skin conductance response) and cognitive effort (tonic pupil dilation) were measured during the task. Results showed that some pairs were actually able to develop a role-alternating system over time through tacit coordination, but coordinated action was also vulnerable to anxiety and mistrust among participants. Overall, these results imply that, besides the mutual behavioral control that often characterizes repeated interaction, cognitive control of emotional arousal may be a critical psychological factor for the emergence of coordinated cooperation.",,,,,,,,,,,,,,,,,,,,,,,SEP,2019,40,5,,,,,427,435,,10.1016/j.evolhumbehav.2019.05.004,,,,,,Psychology; Behavioral Sciences; Biomedical Social Sciences,,,,,,,2022-04-02,
J,"Wam, HK; Eldegard, K; Hjeljord, O",,,,"Wam, H. K.; Eldegard, K.; Hjeljord, O.",,,From overlooking to concealed: predator avoidance in an apex carnivore,EUROPEAN JOURNAL OF WILDLIFE RESEARCH,,,English,Article,,,,,,Human activity; Landscape of fear; Predation risk,WOLVES; HUMANS; DISTURBANCE,"Many prey species select bed sites that reduce the risk of being caught off guard. We investigated bed sites used by an apex predator (gray wolf, Canis lupus) before and after individuals were approached by humans (N = 48 trials). On 9 out of 10 days, the unprovoked wolves rested at sites high in the terrain with a good overview (overlooking sites). After being approached, they resettled on more concealed sites lower in the terrain. Solitary yearlings used less overlooking sites than adults both before and after disturbance. The study provides experimental evidence that wolves' behavioural response to approaching humans is analogous to predator avoidance in prey species.",,,,,,,,,,,,,,,,,,,,,,,DEC,2012,58,6,,,,,1001,1003,,10.1007/s10344-012-0670-y,,,,,,Environmental Sciences & Ecology; Zoology,,,,,,,2022-04-02,
J,"Morelli, F; Benedetti, Y; Diaz, M; Grim, T; Ibanez-Alamo, JD; Jokimaki, J; Kaisanlahti-Jokimaki, ML; Tatte, K; Marko, G; Jiang, YT; Tryjanowski, P; Moller, AP",,,,"Morelli, Federico; Benedetti, Yanina; Diaz, Mario; Grim, Tomas; Ibanez-Alamo, Juan Diego; Jokimaki, Jukka; Kaisanlahti-Jokimaki, Marja-Liisa; Tatte, Kunter; Marko, Gabor; Jiang, Yiting; Tryjanowski, Piotr; Moller, Anders Pape",,,Contagious fear: Escape behavior increases with flock size in European gregarious birds,ECOLOGY AND EVOLUTION,,,English,Article,,,,,,birds; dilution effect; fear response; FID; gregariousness; human disturbance; social interactions; vigilance,FLIGHT-INITIATION DISTANCE; RESPONSE DISTANCES; LIFE-HISTORY; URBAN; PREDATION; DISTURBANCE; RISK; EVOLUTION; VIGILANCE; ADAPTATION,"Flight initiation distance (FID), the distance at which individuals take flight when approached by a potential (human) predator, is a tool for understanding predator-prey interactions. Among the factors affecting FID, tests of effects of group size (i.e., number of potential prey) on FID have yielded contrasting results. Group size or flock size could either affect FID negatively (i.e., the dilution effect caused by the presence of many individuals) or positively (i.e., increased vigilance due to more eyes scanning for predators). These effects may be associated with gregarious species, because such species should be better adapted to exploiting information from other individuals in the group than nongregarious species. Sociality may explain why earlier findings on group size versus FID have yielded different conclusions. Here, we analyzed how flock size affected bird FID in eight European countries. A phylogenetic generalized least square regression model was used to investigate changes in escape behavior of bird species in relation to number of individuals in the flock, starting distance, diet, latitude, and type of habitat. Flock size of different bird species influenced how species responded to perceived threats. We found that gregarious birds reacted to a potential predator earlier (longer FID) when aggregated in large flocks. These results support a higher vigilance arising from many eyes scanning in birds, suggesting that sociality may be a key factor in the evolution of antipredator behavior both in urban and rural areas. Finally, future studies comparing FID must pay explicit attention to the number of individuals in flocks of gregarious species.",,,,,,,,,,,,,,,,,,,,,,,MAY,2019,9,10,,,,,6096,6104,,10.1002/ece3.5193,,,,,,Environmental Sciences & Ecology; Evolutionary Biology,,,,,,,2022-04-02,
J,"Wilson, CA; Vazdarjanova, A; Terry, AV",,,,"Wilson, Christina A.; Vazdarjanova, Almira; Terry, Alvin V., Jr.",,,"Exposure to variable prenatal stress in rats: Effects on anxiety-related behaviors, innate and contextual fear, and fear extinction",BEHAVIOURAL BRAIN RESEARCH,,,English,Article,,,,,,Maternal stress; Corticosterone; Cognition; Memory; Schizophrenia; Stereotypy,MATERNAL STRESS; MINERALOCORTICOID RECEPTORS; OPEN-FIELD; MEMORY; CORTICOSTERONE; PREGNANCY; RESPONSES; BRAIN; RISK; SCHIZOPHRENIA,"Rats repeatedly exposed to variable prenatal stress (PNS) exhibit behavioral features often observed in neuropsychiatric disorders including elevated sensitivity to stimulants and impairments of attention, inhibitory control and memory-related task performance. However, to date there have been relatively few studies designed to assess the effects of PNS on anxiety, stress and fear responses, or the function of the hypothalamic-pituitary-adrenal (HPA) axis (a system clearly linked to stress and fear-related responses as well as neuropsychiatric disorders). In the current study, rats exposed to variable PNS were evaluated for anxiety-related behaviors in open field, elevated plus maze, and light/dark preference tasks. Innate fear responses were assessed using a predatory odor task and learned fear and extinction were assessed with a contextual fear conditioning task. As an indicator of HPA axis function, serum corticosterone levels were determined by enzyme immunoassay at various time points. The results indicated that PNS resulted in several behavioral anomalies including decreased innate fear responses to predator odor, impaired fear extinction, increased locomotor activity and stereotypic-like behaviors. Baseline levels of corticosterone in PNS subjects were similar to non-stressed controls; however, when exposed to acute stress, they exhibited an increase in corticosterone that was greater in magnitude. PNS was not associated with increased anxiety-like behaviors or deficits in learning or retention during contextual fear conditioning. Collectivity, these data support the argument that variable PNS in rats is a valid model system for studying some behavioral components of neuropsychiatric disorders as well as the influence of stress hormones. (c) 2012 Elsevier B.V. All rights reserved.",,,,,,,,,,,,,,,,,,,,,,,FEB 1,2013,238,,,,,,279,288,,10.1016/j.bbr.2012.10.003,,,,,,Behavioral Sciences; Neurosciences & Neurology,,,,,,,2022-04-02,
J,"Clinchy, M; Schulkin, J; Zanette, LY; Sheriff, MJ; McGowan, PO; Boonstra, R",,,,"Clinchy, Michael; Schulkin, Jay; Zanette, Liana Y.; Sheriff, Michael J.; McGowan, Patrick O.; Boonstra, Rudy",,,The neurological ecology of fear: insights neuroscientists and ecologists have to offer one another,FRONTIERS IN BEHAVIORAL NEUROSCIENCE,,,English,Article,,,,,,animal model of PTSD; indirect predator effects; post-traumatic stress disorder; predation risk; predator stress,PREDATION RISK; BEHAVIORAL-INHIBITION; STRESS HORMONES; SINGLE EXPOSURE; CLUTCH SIZE; RAT-BRAIN; IMMUNOREACTIVITY; NEUROENDOCRINE; REPRODUCTION; EPIGENETICS,"That the fear and stress of life-threatening experiences can leave an indelible trace on the brain is most clearly exemplified by post-traumatic stress disorder (PTSD). Many researchers studying the animal model of PTSD have adopted utilizing exposure to a predator as a life-threatening psychological stressor, to emulate the experience in humans, and the resulting body of literature has demonstrated numerous long-lasting neurological effects paralleling those in PTSD patients. Even though much more extreme, predator-induced fear and stress in animals in the wild was, until the 1990s, not thought to have any lasting effects, whereas recent experiments have demonstrated that the effects on free-living animals are sufficiently long-lasting to even affect reproduction, though the lasting neurological effects remain unexplored. We suggest neuroscientists and ecologists both have much to gain from collaborating in studying the neurological effects of predator-induced fear and stress in animals in the wild. We outline the approaches taken in the lab that appear most readily translatable to the field, and detail the advantages that studying animals in the wild can offer researchers investigating the predator model of PTSD.",,,,,,,,,,,,,,,,,,,,,,,APR 25,2011,5,,,,,,,,21,10.3389/fnbeh.2011.00021,,,,,,Behavioral Sciences; Neurosciences & Neurology,,,,,,,2022-04-02,
J,"Benevides, LJ; Cardozo-Ferreira, GC; Ferreira, CEL; Pereira, PHC; Pinto, TK; Sampaio, CLS",,,,"Benevides, Larissa J.; Cardozo-Ferreira, Gabriel C.; Ferreira, Carlos Eduardo L.; Pereira, Pedro Henrique C.; Pinto, Taciana K.; Sampaio, Claudio Luis S.",,,Fear-induced behavioural modifications in damselfishes can be diver-triggered,JOURNAL OF EXPERIMENTAL MARINE BIOLOGY AND ECOLOGY,,,English,Article,,,,,,Diver disturbance; Fish behaviour; Stegastes fuscus; Territoriality,CORAL COLONY SIZE; REEF FISHES; TERRITORIAL DAMSELFISH; BENTHIC ORGANISMS; TROPHIC STRUCTURE; ANIMAL BEHAVIOR; HABITAT USE; TOURISM; DETERMINANTS; COMMUNITIES,"Fear is a short-term response arisen from the way an animal perceives its environment when some threat makes it insecure. Thus, the risk perception of predation shapes the cost-benefit decisions associated with food and safety in animal communities. Even non-consumptive human-related activities such as ecotourism may influence species behavioural traits. Marine wildlife tourism might produce different impacts on organisms, stressing and modifying (directly or indirectly) species behaviour, physiology and habitat use. Understand the effects of human presence on site-attached fish' behaviour is crucial to elucidate how dive-tourism could shape their limited-range seascape. Given the importance of the territorial damselfishes as reef farmers and 'ecosystems engineers', here we investigated if the presence of SCUBA divers and snorkelers can disrupt the foraging and territorial defence of the Dusky damselfish, Stegastes fuscus. Experimental approaches (diver presence and absence) were applied in 30 territories of S. fuscus using underwater remote video cameras. Behavioural responses were analysed by considering the frequency of refuge, foraging and chase behaviours. Both recreational dive activities had an analogous role in frighten and disturb the Dusky damselfish activities. Considering the frequency of behaviours displayed in diver's absence vs presence, S. fuscus increased its refuge times from approximately 2% to 50% on SCUBA diver presence and from 9% to 43% in snorkeler presence. It is directly linked to the missed feeding opportunities, which reduced by half during both diver's presence. Damselfish's aggressiveness proportionally dropped (0.3%) during SCUBA diver presence but increased (2.4%) while snorkeler was present. However, the average frequency of chase behaviour reduced with both divers' approach. Interruptions in damselfish behaviour may modify the resource monopolization and productivity inside their territories, affecting its relationships with other species beyond the boundaries of their territoriality, and leading a possible change on its functional role in the reef community. Territorial reef fish behaviour and their relationship with divers' presence can provide a more holistic comprehension regarding the seascape of fear concept and could be useful as an indicator of human disturbances.",,,,,,,,,,,,,,,,,,,,,,,MAY-JUN,2019,514,,,,,,34,40,,10.1016/j.jembe.2019.03.009,,,,,,Environmental Sciences & Ecology; Marine & Freshwater Biology,,,,,,,2022-04-02,
J,"Cavalli, M; Baladron, AV; Isacch, JP; Biondi, LM; Bo, MS",,,,"Cavalli, Matilde; Baladron, Alejandro V.; Pablo Isacch, Juan; Biondi, Laura M.; Susana Bo, Maria",,,Differential risk perception of rural and urban Burrowing Owls exposed to humans and dogs,BEHAVIOURAL PROCESSES,,,English,Article,,,,,,Athene cunicularia; Flight initiation distance; Aggressiveness; Behaviour; Predators,NEST-DEFENSE BEHAVIOR; INDIVIDUAL CONSISTENCY; ATHENE-CUNICULARIA; STRESS PHYSIOLOGY; FLIGHT DISTANCES; PREDATION; BIRDS; ECOLOGY; LIFE; HABITUATION,"Urban areas expose wildlife to an array of novel predators, amongst which, humans and dogs are highly frequent. Thus, wild animals living in urban areas are forced to invest more time and energy in defence behaviours, which depend on how the risk is perceived and assessed. We experimentally tested whether Burrowing owls coming from rural and urban habitats showed differences in behavioural responses when facing humans and domestic dogs. We measured flight initiation distances (FIDs), nest returning, and aggressiveness level when owls faced a human and a human with a dog walking towards them. Our results showed that urban owls recognise a human with a dog as a greater threat than a human alone, thus indicating that fear of domestic animals should be considered as affecting owls' settlement in cities and towns. On the other hand, rural owls perceived human and dogs as similar threats, but showed higher FIDs, less aggressiveness, and lower tendency to return to the nest than urban owls in both treatments. These findings emphasize the importance of modified habitats in modelling the response of urban and rural owls to predators and represent another step in the explanation of how wild animals assess and respond to threats associated with living in urbanized environments. (c) 2015 Elsevier B.V. All rights reserved.",,,,,,,,,,,,,,,,,,,,,,,MAR,2016,124,,,,,,60,65,,10.1016/j.beproc.2015.12.006,,,,,,Psychology; Behavioral Sciences; Zoology,,,,,,,2022-04-02,
J,"Prokop, P; Usak, M; Fancovicova, J",,,,"Prokop, Pavol; Usak, Muhammet; Fancovicova, Jana",,,Risk of parasite transmission influences perceived vulnerability to disease and perceived danger of disease-relevant animals,BEHAVIOURAL PROCESSES,,,English,Article,,,,,,Disgust; Fear; Parasites; Pets; Perceived vulnerability to disease,PREJUDICIAL ATTITUDES; INFECTIOUS-DISEASES; DISGUST; PREVALENCE; AVOIDANCE; FEAR; EVOLUTIONARY; VARIABILITY; PERSONALITY; MECHANISMS,"Adaptationist view proposes that emotions were shaped by natural selection and their primary function is to protect humans against predators and/or disease threat. This study examined cross-cultural and interpersonal differences in behavioural immune system measured by disgust, fear and perceived danger in participants from high (Turkey) and low (Slovakia) pathogen prevalence areas. We found that behavioural immune system in Turkish participants was activated more than those of Slovakian participants when exposed to photographs depicting disease-relevant cues, but not when exposed to disease-irrelevant cues. However, participants from Slovakia, where human to human disease transmission is expected to be more prevalent than in Turkey, showed lower aversion in Germ Aversion subscale supporting hypersensitiveness of the behavioural immune system. Having animals at home was less frequent both in Turkey and in participants who perceived higher danger about disease relevant animals. Participants more vulnerable to diseases reported higher incidence of illness last year and considered perceived disease-relevant animals more dangerous than others. Females showed greater fear, disgust and danger about disease-relevant animals than males. Our results further support the finding that cultural and inter-personal differences in human personality are influenced by parasite threat. (C) 2010 Elsevier B.V. All rights reserved.",,,,,,,,,,,,,,,,,,,,,,,SEP,2010,85,1,,,,,52,57,,10.1016/j.beproc.2010.06.006,,,,,,Psychology; Behavioral Sciences; Zoology,,,,,,,2022-04-02,
J,"Bonnot, NC; Hewison, AJM; Morellet, N; Gaillard, JM; Debeffe, L; Couriot, O; Cargnelutti, B; Chaval, Y; Lourtet, B; Kjellander, P; Vanpe, C",,,,"Bonnot, Nadege C.; Hewison, A. J. Mark; Morellet, Nicolas; Gaillard, Jean-Michel; Debeffe, Lucie; Couriot, Ophelie; Cargnelutti, Bruno; Chaval, Yannick; Lourtet, Bruno; Kjellander, Petter; Vanpe, Cecile",,,Stick or twist: roe deer adjust their flight behaviour to the perceived trade-off between risk and reward,ANIMAL BEHAVIOUR,,,English,Article,,,,,,assessment interval; deer; detection delay; flight initiation distance; flush early and avoid the rush hypothesis; optimal escape theory; risk assessment; risk-resource trade-off; starting distance; threat monitoring,INITIATION DISTANCE; HUMAN DISTURBANCE; PREDATION RISK; HABITAT SELECTION; GROUP-SIZE; LANDSCAPE; VIGILANCE; FRAGMENTATION; REGRESSION; ESCAPE,"Because avoiding predation is crucial for fitness, foraging animals must trade acquisition of high-quality resources against risk avoidance when the best resources occur in locations with high predation risk. Although optimality models predict the distance at which an animal should initiate vigilance and flight, many studies have shown that animals generally flee soon after detecting an approaching threat, supporting the 'flush early and avoid the risk' (FEAR) hypothesis. Despite this, flight behaviour varies markedly depending on context, suggesting some behavioural plasticity in the response of prey to a given threat. We evaluated the degree of plasticity in the flight responses of roe deer, Capreolus capreolus, a highly flexible species which thrives in human-dominated landscapes. Based on individually identifiable animals and a standardized flight initiation protocol, we measured the distance at which a deer detected an approaching threat, and the distance at which it subsequently initiated flight. Our results provide strong support for the FEAR hypothesis, suggesting that alert and flight responses are strongly coupled in roe deer. However, the perceived level of both risk (in terms of landscape openness and proximity to human infrastructure) and reward (in terms of habitat quality) influenced the time it took for a deer to detect an approaching threat, and the subsequent time for which the threat was tolerated prior to flight. Overall, our findings indicate that although roe deer minimize monitoring costs when assessing risk by fleeing early, they also adjust their monitoring and flight responses to the local risk-resource trade-off. (C) 2016 Published by Elsevier Ltd on behalf of The Association for the Study of Animal Behaviour.",,,,,,,,,,,,,,,,,,,,,,,FEB,2017,124,,,,,,35,46,,10.1016/j.anbehav.2016.11.031,,,,,,Behavioral Sciences; Zoology,,,,,,,2022-04-02,
