J,"Martin, J; de Neve, L; Polo, V; Fargallo, JA; Soler, M",,,,"Martin, J.; de Neve, L.; Polo, V.; Fargallo, J. A.; Soler, M.",,,Health-dependent vulnerability to predation affects escape responses of unguarded chinstrap penguin chicks,BEHAVIORAL ECOLOGY AND SOCIOBIOLOGY,,,English,Article,,,,,,prey vulnerability; penguins; health condition; immunocompetence; fear; antipredatory behavior,PYGOSCELIS-ANTARCTICA; CRECHING BEHAVIOR; HUMAN DISTURBANCE; RISK-ASSESSMENT; KING PENGUIN; BIRDS; IMMUNOCOMPETENCE; DECISIONS; DISTANCE; DEFENSE,"Predators may select more often to attack the more vulnerable prey or those with an inferior health status. Thus, prey should be able to assess their own vulnerability to predation and modify their antipredatory behavior accordingly. When approached by predator skuas, unguarded penguin chicks flee short distances, and usually aggregate in dense packs, but there is a clear interindividual variability in their responses under similar conditions. We hypothesized that this variability in escape responses might be related to the perceived vulnerability to predation of each individual chick. We simulated predator attacks to chinstrap penguin chicks and analyzed the sources of variation in their escape response, such as the presence of adults or the density of other chicks, and the sex, age, body condition, and health status of responding chicks. Chicks allowed shorter approach distances when they had a better health condition (i.e., a greater T-cell-mediated immunity, CMI), when they were younger, and when the density of adults around was higher. Sex and density of other chicks were not important. Similarly, chicks fled from the experimenter to longer distances when they had a lower CMI and when the density of adults was lower. Therefore, escape characteristics of chicks depended on the presence of adults that can deter predators and on the health-dependent vulnerability of chicks.",,,,,,,,,,,,,,,,,,,,,,,OCT,2006,60,6,,,,,778,784,,10.1007/s00265-006-0221-1,,,,,,Behavioral Sciences; Environmental Sciences & Ecology; Zoology,,,,,,,2022-04-02,
J,"Keyel, AC; Peck, DT; Reed, JM",,,,"Keyel, Alexander C.; Peck, David T.; Reed, J. Michael",,,NO EVIDENCE FOR INDIVIDUAL ASSORTMENT BY TEMPERAMENT RELATIVE TO PATCH AREA OR PATCH OPENNESS IN THE BOBOLINK,CONDOR,,,English,Article,,,,,,area sensitivity; behavioral syndrome; boldness; fear; intraclass correlation coefficient; personality,BEHAVIORAL-RESPONSES; GRASSLAND BIRDS; SENSITIVITY; DISTURBANCE; DISTANCES; RISK; REPEATABILITY; CONSEQUENCES; METAANALYSIS; PERSONALITY,"Recent research has shown repeatable individual variability in temperament traits. We tested the hypotheses that individual Bobolinks (Dolichonyx oryzivorus) vary consistently in their response to predators, a temperament trait, and that this individual variation is associated with breeding-site selection. Specifically, we tested whether measures of behavioral response to human approaches are associated with either patch area or patch openness and thus to area sensitivity. We made two to seven sequential approaches to Bobolinks in 2009 and 2010, measuring starting distance, flight-initiation distance, and the distance from the observers to where the birds landed. We analyzed the data with repeatability estimates and linear mixed modeling. Flight-initiation distance was repeatable when starting distance was controlled for, but distance to landing was not after starting distance and flight-initiation distance were controlled for. We found no strong effect of area or openness on either flight-initiation distance or distance to landing. We conclude that this measure of response to predators shows individual variation, but this variation does not explain patterns of settlement among habitat patches. Because flight-initiation distance is often used to identify distances at which human behavior disrupts wildlife, we estimate its mean (21.8 m) and the distance at which 75%, 95%, and 99% of the Bobolinks flushed (28, 40, and 59 m, respectively).",,,,,,,,,,,,,,,,,,,,,,,FEB,2012,114,1,,,,,212,218,,10.1525/cond.2012.110095,,,,,,Zoology,,,,,,,2022-04-02,
J,"Clement, RJG; Macri, S; Porfiri, M",,,,"Clement, Romain J. G.; Macri, Simone; Porfiri, Maurizio",,,Design and development of a robotic predator as a stimulus in conditioned place aversion for the study of the effect of ethanol and citalopram in zebrafish,BEHAVIOURAL BRAIN RESEARCH,,,English,Article,,,,,,Citalopram; Conditioned place aversion aversion; Danio rerio; Ethanol; Ethorobotics; Predation risk,COMPUTER-ANIMATED IMAGES; BEHAVIORAL-RESPONSES; ANXIETY; PREFERENCE; ALCOHOL; MODELS; FEAR; LIGHT/DARK; DISORDERS; SEROTONIN,"Zebrafish are becoming a species of choice in psychopharmacology, laying a promising path to refined pharmacological manipulations and high-throughput behavioral phenotyping. The field of robotics has the potential to accelerate progress along this path, by offering unprecedented means for the design and development of accurate and reliable experimental stimuli. In this work, we demonstrate, for the first time, the integration of robotic predators in place conditioning experiments. We hypothesized zebrafish to be capable of forming a spatial association under a simulated predation risk. We repeatedly exposed experimental subjects to a robotic heron impacting the water surface and then evaluated their spatial avoidance within the experimental tank in a subsequent predator-free test session. To pharmacologically validate the paradigm, we tested zebrafish in drugfree conditions (control groups) or in response to three different concentrations of citalopram (30, 50, and 100 mg/L) and ethanol (0.25, 0.50, and 1.00%). Experimental data indicate that, when tested in the absence of the conditioning stimulus, zebrafish displayed a marked preference for the bottom of the test tank, that is, the farthest location from the simulated attacks by the robotic heron. This conditioned geotaxis was reduced by the administration of citalopram in a linear dose-response curve and ethanol at the low concentration. Ultimately, our data demonstrate that robotic stimuli may represent valid conditioning tools and, thereby, aid the field of zebrafish psychopharmacology.",,,,,,,,,,,,,,,,,,,,,,,JAN 27,2020,378,,,,,,,,112256,10.1016/j.bbr.2019.112256,,,,,,Behavioral Sciences; Neurosciences & Neurology,,,,,,,2022-04-02,
J,"Blumstein, DT",,,,"Blumstein, Daniel T.",,,Habituation and sensitization: new thoughts about old ideas,ANIMAL BEHAVIOUR,,,English,Article,,,,,,conservation behaviour; habituation; human disturbance; sensitization; tolerance,FLIGHT-INITIATION DISTANCE; RISK-TAKING BEHAVIOR; HUMAN DISTURBANCE; PREDATION RISK; INDIVIDUAL CONSISTENCY; LIFE-HISTORY; RESPONSES; HUMANS; FEAR; WILDLIFE,"People have written about habituation, a process that leads to decreased responsiveness to a stimulus, as well as its counterpart, sensitization, or an increased responsiveness to a stimulus, for over 2000 years. And, while intensive research in the last century has led to well-supported generalizations about mechanisms of habituation, we have not developed a 'natural history' of habituation and tolerance that would help us predict, based on life history and natural history variation, how species will respond to humans and anthropogenic stimuli. The need for predictive models has never been greater. In this essay I will review generalizations about these learning processes and point out how a clear understanding of mechanism can be used to inform wildlife management and generate testable management interventions. I will also highlight unanswered questions about habituation and sensitization, and establish the groundwork for developing a natural history of habituation and tolerance. (C) 2016 The Association for the Study of Animal Behaviour. Published by Elsevier Ltd. All rights reserved.",,,,,,,,,,,,,,,,,,,,,,,OCT,2016,120,,,,,,255,262,,10.1016/j.anbehav.2016.05.012,,,,,,Behavioral Sciences; Zoology,,,,,,,2022-04-02,
J,"Garcia-Arroyo, M; MacGregor-Fors, I",,,,"Garcia-Arroyo, Michelle; MacGregor-Fors, Ian",,,"Tolerant to humans? Assessment of alert and flight initiation distances of two bird species in relation to sex, flock size, and environmental characteristics",ETHOLOGY ECOLOGY & EVOLUTION,,,English,Article,,,,,,behavior; FID; House sparrow; Orange-breasted bunting; Passer domesticus; Passerina leclancherii; urban ecology,PREDATION RISK; HUMAN DISTURBANCE; HOUSE SPARROW; URBAN; FEAR; BEHAVIOR; URBANIZATION; AGGRESSION; INCREASES; RESPONSES,"Birds invest time and resources in escape behaviors, thus changing their foraging strategies, habitat selection, and even reproduction. Flight initiation distance (FID) and the distance at which birds detect a threat, alert distance (AD), have been used as indicators of the ability of birds to detect potential predators. In this study we compared the two aforementioned measures of risk reaction for the House sparrow and the Orange-breasted bunting, two bird species inhabiting the same urban areas, and assessed if they were related with sex, flock size, and environmental factors. We performed generalized linear mixed models (GLMM) to explore the relationships between environmental factors and ADs and FIDs. Both behavioral responses were significantly lower for House sparrows. Although we did not find significant relationships between the assessed variables (sex, flock size, environmental factors) and bunting ADs and FIDs, we did find House sparrow males to be bolder (showing shorter ADs and FIDs), as well as larger ADs and FIDs for sparrows with increasing flock size. House sparrow ADs and FIDs were positively related with herbaceous plant cover and negatively related with minimum building height. In general, House sparrows showed to be bolder than Orange-breasted buntings, with differential responses of the sparrow related with sex, flock size, and different environmental factors. Having recorded bolder House sparrow males could be due to increases in aggressiveness related to the breeding season. Our results add to the lacking behavioral information available for the endemic Orange-breasted bunting and provide insights on the variation of the behavior of House sparrows in small urban areas.",,,,,,,,,,,,,,,,,,,,,,,SEP 2,2020,32,5,,,,,445,456,,10.1080/03949370.2020.1753115,,MAY 2020,,,,Behavioral Sciences; Zoology,,,,,,,2022-04-02,
J,"GRIEBEL, G; BLANCHARD, DC; JUNG, A; MASUDA, CK; BLANCHARD, RJ",,,,"GRIEBEL, G; BLANCHARD, DC; JUNG, A; MASUDA, CK; BLANCHARD, RJ",,,5-HT1A AGONISTS MODULATE MOUSE ANTIPREDATOR DEFENSIVE BEHAVIOR DIFFERENTLY FROM THE 5-HT2A ANTAGONIST PIRENPERONE,PHARMACOLOGY BIOCHEMISTRY AND BEHAVIOR,,,English,Article,,,,,,5-HT1A AGONISTS; 5-HT2A ANTAGONIST; 8-OH-DPAT; GEPIRONE; PIRENPERONE; SEROTONIN; FLIGHT; ANTIPREDATOR DEFENSE; FEAR; ANXIETY; PANIC; SWISS-WEBSTER MOUSE; RISK ASSESSMENT,GENERALIZED ANXIETY DISORDER; RATS RATTUS-RATTUS; ELEVATED PLUS-MAZE; PANIC DISORDER; DOUBLE-BLIND; RECEPTOR AGONISTS; AGGRESSIVE-BEHAVIOR; MULTICENTER TRIAL; SOCIAL PHOBIA; BUSPIRONE,"The mouse defense test battery (MDTB) has been designed to investigate defensive reactions in Swiss-Webster mice to situations associated with a natural predator, the rat, such as flight, avoidance, defensive threat, defensive attack, and risk assessment activities. The present study evaluated the ability of 8-OH-DPAT (0.05-10 mg/kg, SC, 5) and gepirone (2.5-10 mg/kg, IP, 30), a full- and a partial agonist at 5-HT1A sites, as well as pirenperone (0.25-1 mg/kg, IP, 30), a preferential 5-HT2A receptor antagonist, to exert an anxiolytic-like action in the MDTB. The most consistent effect of both 5-HT1A receptor agonists across tests was a marked reduction in predator assessment activity and defensive attack behavior. In contrast, neither of the two ligands was able to reduce flight responses to the approaching predator, and both failed to reduce in a specific manner contextual defense behaviors after the predator was removed. The 5-HT2A receptor antagonist pirenperone did not provide significant indication of an anxiolytic effect on predator assessment activity and postpredator potentiation of contextual defense responses, and had negligible influence on antipredator defensive behavior. The most interesting exception to this profile was a dose-related reduction in flight-related measures. In view of previous results indicating that the panic-promoting drug yohimbine increases flight/escape reactions and that the panicolytic compound alprazolam reduces these responses, we tentatively suggest that the preferential 5-HT2A receptor antagonist pirenperone may have some efficacy in improving panic attacks. In addition, the lack of effect of the 5-HT1A receptor agonists on these flight responses is consistent with clinical findings indicating that these agents are of limited use in the treatment of panic disorder. These findings suggest that the MDTB provides behavioural measures capable of differentiating between various classes of antianxiety drugs.",,,,,,,,,,,,,,,,,,,,,,,JUN-JUL,1995,51,2-3,,,,,235,244,,10.1016/0091-3057(94)00360-U,,,,,,Behavioral Sciences; Neurosciences & Neurology; Pharmacology & Pharmacy,,,,,,,2022-04-02,
J,"Licata, F; Harison, RF; Ficetola, GF; Freeman, K; Muller, BJ; Ponga, VR; Andreone, F; Crottini, A",,,,"Licata, Fulvio; Harison, Rodino Fetraharijaona; Ficetola, Gentile Francesco; Freeman, Karen; Muller, Benjamin J.; Ponga, Virginia Rodriguez; Andreone, Franco; Crottini, Angelica",,,Toad invasion of Malagasy forests triggers severe mortality of a predatory snake,BIOLOGICAL INVASIONS,,,English,Article,,,,,,Toad poisoning; Duttaphrynus melanostictus; Malagasy cat-eyed snake; N-mixture models; Mortality rates,N-MIXTURE MODELS; CANE TOADS; DUTTAPHRYNUS-MELANOSTICTUS; ABUNDANCE; MADAGASCAR; DIVERSITY; COMMUNITIES; PATTERNS; IMPACT; SIZE,"The Asian common toad Duttaphrynus melanostictus has been introduced to the eastern province of Toamasina in Madagascar, where it is feared to be having devastating effects on native communities by poisoning frog-eating predators. So far it is unclear whether the toad can invade forest habitats, and empirical evidence of its impact on native predators is lacking. We used radio tracking to investigate the spatial behaviour of adult toads in a small parcel of lowland humid forest and we quantify the disruptive effects of toad poisoning on a native frog-eating snake, the Malagasy cat-eyed snake (Madagascarophis colubrinus). We used N-mixture models to estimate the population size of cat-eyed snakes, and used the mortality events recorded in the same area to obtain an estimate of monthly mortality rate of snakes due to toad poisoning. Our results point to a drastic mortality rate of snakes that, if constant through the year, could halve the predator population, with the potential risk of local extirpation. We expect cat-eyed snake populations across rural and suburban areas of Toamasina to be severely affected by the toad invasion, and suggest that future research should investigate the effects of indirect facilitation of human-commensal rodents and the potential repercussions on human health and well-being.",,,,,,,,,,,,,,,,,,,,,,,APR,2022,24,4,,,,,1189,1198,,10.1007/s10530-021-02708-z,,JAN 2022,,,,Biodiversity & Conservation; Environmental Sciences & Ecology,,,,,,,2022-04-02,
J,"Kuijper, DPJ; Sahlen, E; Elmhagen, B; Chamaille-Jammes, S; Sand, H; Lone, K; Cromsigt, JPGM",,,,"Kuijper, D. P. J.; Sahlen, E.; Elmhagen, B.; Chamaille-Jammes, S.; Sand, H.; Lone, K.; Cromsigt, J. P. G. M.",,,Paws without claws? Ecological effects of large carnivores in anthropogenic landscapes,PROCEEDINGS OF THE ROYAL SOCIETY B-BIOLOGICAL SCIENCES,,,English,Article,,,,,,human-dominated landscapes; behaviourally mediated effects; density-mediated effects; trophic cascades; recolonizing carnivores,BIALOWIEZA PRIMEVAL FOREST; HUMAN-DOMINATED LANDSCAPES; PREDATION RISK; ROE DEER; ECOSYSTEM RESTORATION; BEHAVIORAL-RESPONSES; TOP PREDATOR; WOLVES; PREY; FEAR,"Large carnivores are frequently presented as saviours of biodiversity and ecosystem functioning through their creation of trophic cascades, an idea largely based on studies coming primarily out of relatively natural landscapes. However, in large parts of the world, particularly in Europe, large carnivores live in and are returning to strongly human-modified ecosystems. At present, we lack a coherent framework to predict the effects of large carnivores in these anthropogenic landscapes. We review how human actions influence the ecological roles of large carnivores by affecting their density or behaviour or those of mesopredators or prey species. We argue that the potential for density-mediated trophic cascades in anthropogenic landscapes is limited to unproductive areas where even low carnivore numbers may impact prey densities or to the limited parts of the landscape where carnivores are allowed to reach ecologically functional densities. The potential for behaviourally mediated trophic cascades may be larger and more widespread, because even low carnivore densities affect prey behaviour. We conclude that predator-prey interactions in anthropogenic landscapes will be highly context-dependent and human actions will often attenuate the ecological effects of large carnivores. We highlight the knowledge gaps and outline a new research avenue to study the role of carnivores in anthropogenic landscapes.",,,,,,,,,,,,,,,,,,,,,,,OCT 26,2016,283,1841,,,,,,,20161625,10.1098/rspb.2016.1625,,,,,,Life Sciences & Biomedicine - Other Topics; Environmental Sciences & Ecology; Evolutionary Biology,,,,,,,2022-04-02,
J,"Deslauriers, J; Toth, M; Der-Avakian, A; Risbrough, VB",,,,"Deslauriers, Jessica; Toth, Mate; Der-Avakian, Andre; Risbrough, Victoria B.",,,"Current Status of Animal Models of Posttraumatic Stress Disorder: Behavioral and Biological Phenotypes, and Future Challenges in Improving Translation",BIOLOGICAL PSYCHIATRY,,,English,Review,,,,,,Animal model; Immobilization; Predator stress; PTSD; Shock; Single prolonged stress; Social defeat; Unpredictable variable stress,SINGLE-PROLONGED STRESS; CORTICOTROPIN-RELEASING-FACTOR; PTSD-LIKE SYMPTOMS; UNPREDICTABLE MILD STRESS; DEPRESSION-LIKE BEHAVIOR; PITUITARY-ADRENAL AXIS; REPEATED SOCIAL DEFEAT; TRAUMATIC STRESS; PREFRONTAL CORTEX; MOUSE MODEL,"Increasing predictability of animal models of posttraumatic stress disorder (PTSD) has required active collaboration between clinical and preclinical scientists. Modeling PTSD is challenging, as it is a heterogeneous disorder with >= 20 symptoms. Clinical research increasingly utilizes objective biological measures (e.g., imaging, peripheral biomarkers) or nonverbal behaviors and/or physiological responses to complement verbally reported symptoms. This shift toward more-objectively measurable phenotypes enables refinement of current animal models of PTSD, and it supports the incorporation of homologous measures across species. We reviewed.600 articles to examine the ability of current rodent models to probe biological phenotypes of PTSD (e.g., sleep disturbances, hippocampal and fear-circuit dysfunction, inflammation, glucocorticoid receptor hypersensitivity) in addition to behavioral phenotypes. Most models reliably produced enduring generalized anxiety-like or depression-like behaviors, as well as hyperactive fear circuits, glucocorticoid receptor hypersensitivity, and response to long-term selective serotonin reuptake inhibitors. Although a few paradigms probed fear conditioning/extinction or utilized peripheral immune, sleep, and noninvasive imaging measures, we argue that these should be incorporated more to enhance translation. Data on female subjects, on subjects at different ages across the life span, or on temporal trajectories of phenotypes after stress that can inform model validity and treatment study design are needed. Overall, preclinical (and clinical) PTSD researchers are increasingly incorporating homologous biological measures to assess markers of risk, response, and treatment outcome. This shift is exciting, as we and many others hope it not only will support translation of drug efficacy from animal models to clinical trials but also will potentially improve predictability of stage II for stage III clinical trials.",,,,,,,,,,,,,,,,,,,,,,,MAY 15,2018,83,10,,,SI,,895,907,,10.1016/j.biopsych.2017.11.019,,,,,,Neurosciences & Neurology; Psychiatry,,,,,,,2022-04-02,
J,"SHEPHERD, JK; FLORES, T; RODGERS, RJ; BLANCHARD, RJ; BLANCHARD, DC",,,,"SHEPHERD, JK; FLORES, T; RODGERS, RJ; BLANCHARD, RJ; BLANCHARD, DC",,,THE ANXIETY DEFENSE TEST BATTERY - INFLUENCE OF GENDER AND RITANSERIN TREATMENT ON ANTIPREDATOR DEFENSIVE BEHAVIOR,PHYSIOLOGY & BEHAVIOR,,,English,Article,,,,,,ANXIETY; DEFENSE; FEAR; ANIMAL MODELS; SEX DIFFERENCES; RITANSERIN; SEROTONIN; 5-HT2,RAT; 5-HT; CHLORDIAZEPOXIDE; BENZODIAZEPINES; DIAZEPAM; AGONISTS; ETHANOL,"The anxiety/defense test battery has been developed to measure defensive reactions in laboratory rats to both direct exposure to, and stimuli associated with, a natural predator, the domestic cat. The present investigation confirmed earlier findings with each test providing a distinct behavioral profile following exposure to predator stimuli. In addition, the data showed a consistent gender difference in a number of these behavioral measures, indicating that females are more defensive than males. These effects included reliably higher levels of cat avoidance and crouching, with lower levels of transits, lying and drinking for cat-exposed females. Similarly, females exposed to a cat odor stimulus showed a reliably higher level of stretch attend and flat back approach behaviors (risk assessment) towards the stimulus block. The 5-HT2 antagonist, ritanserin, failed to provide significant indication of anxiolytic activity, and had minimal influence on antipredator defensive behavior. An important exception to this profile was a reliable decrease in stretch attend behavior to a cat odor stimulus in females but not males. Overall, these findings suggest a complex relationship between gender, antipredator defensive behavior, and anxiolytic drug treatment.",,,,,,,,,,,,,,,,,,,,,,,FEB,1992,51,2,,,,,277,285,,10.1016/0031-9384(92)90141-N,,,,,,Psychology; Behavioral Sciences,,,,,,,2022-04-02,
J,"Andrade, M; Blumstein, DT",,,,"Andrade, Madelin; Blumstein, Daniel T.",,,Anti-predator behavior along elevational and latitudinal gradients in dark-eyed juncos,CURRENT ZOOLOGY,,,English,Article,,,,,,antipredator behavior; FID; latitude; elevation; dark-eyed junco; Junco hyemalis,FLIGHT INITIATION DISTANCE; LIFE-HISTORY; FEAR; PREDATION; DISTURBANCE; RESPONSES; MODELS,"Flight-initiation distance (FID), the distance between an individual and experimenter when it begins to flee, can be used to quantify risk-assessment. Among other factors, prior studies have shown that latitude explains significant variation in avian FID: at lower latitudes, individuals and species have longer FIDs than those living at higher latitudes. No prior studies have focused on the effect of elevation on FID. Given the similar patterns of seasonality, climate, and potentially predator density, that covary between latitude and elevation, birds at higher elevations might tolerate closer approaches. We asked whether elevation or latitude would explain more variation in the FID of a common passerine bird species, dark-eyed juncos (Junco hyemalis). Juncos live in a variety of habitats along both latitudinal and elevational gradients. We found that statistical models containing elevation as a variable explained more of the variation in FID than did models containing latitude. We also found, unexpectedly, that birds at higher elevation fled at greater distances. While more predators were sighted per hour at higher elevations than at lower elevations, the frequency of predator sightings did not explain a significant amount of variation in FID. This result questions whether predator density is the main driver of risk perception along elevational gradients. Nonetheless, because elevation explains more variation in FID than latitude in at least one species, these findings have direct implications on how human impacts on birds are managed. Specifically, those designing set-back zones to reduce human impact on birds may consider modifying them based on both latitude and elevation.",,,,,,,,,,,,,,,,,,,,,,,JUN,2020,66,3,,,,,239,245,,10.1093/cz/zoz046,,,,,,Zoology,,,,,,,2022-04-02,
