"cite.key","Title","Authors","year"
"darlingtonCumulativeEffectsHuman2022","Cumulative effects of human footprint, natural features and predation risk best predict seasonal resource selection by white-tailed deer","S. Darlington, A. Ladle, A.C. Burton, J.P. Volpe, J.T. Fisher","2022"
"crawfordPreyTellsLarge2022","Prey tells, large herbivores fear the human ‘super predator’","Daniel A. Crawford, L. Mike Conner, Michael Clinchy, Liana Y. Zanette, Michael J. Cherry","2022"
"courbinInteractingLethalNonlethal2022","Interacting lethal and nonlethal human activities shape complex risk tolerance behaviors in a mountain herbivore","N Courbin, M Garel, P Marchand, A Duparc, L Debeffe, L Borger, A Loison","2022"
"collinsBehavioralResponsesAnthropogenic2022","Behavioral responses to anthropogenic noise at highways vary across temporal scales","A.C. Collins, T.W. Vickers, F.M. Shilling","2022"
"chen-krausHumanLemurCoexistenceMultipleUse2022","Human-Lemur Coexistence in a Multiple-Use Landscape","C. Chen-Kraus, N.A. Raharinoro, M.A. Randrianirinarisoa, D.J. Anderson, R.R. Lawler, D.P. Watts, A.F. Richard","2022"
"burtonBehavioralBycatchCamera2022","Behavioral “bycatch” from camera trap surveys yields insights on prey responses to human-mediated predation risk","A.C. Burton, C. Beirne, C. Sun, A. Granados, M. Procko, C. Chen, M. Fennell, A. Constantinou, C. Colton, K. Tjaden-McClement, J.T. Fisher, J. Burgar","2022"
"blaskovicTemporalOverlapHuman2022","Temporal overlap of human and apex predator activity on wildlife trails and forest roads","S Blaskovic, T Gomercic, I Toplicanec, M Sindicic","2022"
"barocasRuppellFoxMovement2022","Ruppell's fox movement and spatial behavior are influenced by topography and human activity","A Barocas, R Hefner, M Ucko, B Shalmon, N Leader, E Geffen","2022"
"ausilioEnvironmentalAnthropogenicFeatures2022","Environmental and anthropogenic features mediate risk from human hunters and wolves for moose","G Ausilio, C Wikenros, H Sand, P Wabakken, A Eriksen, B Zimmermann","2022"
"ardila-villamizarFearUrbanLandscapes2022","Fear in urban landscapes Conspecific flock size drives escape decisions in tropical birds","M. Ardila-Villamizar, G. Alarcón-Nieto, A.A. Maldonado-Chaparro","2022"
"fardellSmallPreyAnimal2022","Small Prey Animal Foraging Behaviors in Landscapes of Fear Effects of Predator Presence and Human Activity Along an Urban Disturbance Gradient","LL Fardell, CEM Nano, CR Pavey, CR Dickman","2022"
"bhardwajInducingFearUsing2022","Inducing fear using acoustic stimuli—A behavioral experiment on moose (Alces alces) in Sweden","M. Bhardwaj, D. Lodnert, M. Olsson, A. Winsvold, S.M. Eilertsen, P. Kjellander, A. Seiler","2022"
"vanbeeckcalkoenNumericalTopdownEffects2023","Numerical top-down effects on red deer (Cervus elaphus) are mainly shaped by humans rather than large carnivores across Europe","Suzanne T. S. van Beeck Calkoen, Dries P. J. Kuijper, Marco Apollonio, Lena Blondel, Carsten F. Dormann, Ilse Storch, Marco Heurich","2023"
"ramirezTopdownBottomupForces2023","Top-down and bottom-up forces explain patch utilization by two deer species and forest recruitment","JI Ramirez, L Poorter, PA Jansen, J den Ouden, M Siewert, J Olofsson","2023"
"morelliAreBirdsMore2023","Are birds more afraid in urban parks or cemeteries? A Latin American study contrasts with results from Europe","F. Morelli, L.M. Leveau, P. Mikula, I. MacGregor-Fors, M.L. Bocelli, S.G. Quesada-Acuña, C. González-Lagos, P. Gutiérrez-Tapia, G.F. Dri, C.A. Delgado-V., A.G. Zavala, J. Campos, R. Ortega-Álvarez, A.I. Contreras-Rodríguez, D.S. López, M.C.B. Toledo, A. Sarquis, A. Giraudo, A.L. Echevarria, M.E. Fanjul, M.V. Martínez, J. Haedo, L.G.C. Sanz, Y.A.P. Dominguez, V. Fernandez, V. Marinero, V. Abilhoa, R. Amorin, C.S. Fontana, T.W. da Silva, S.S.Z. Vargas, J.F. Escobar Ibañez, M.D. Juri, S.R. Camín, L. Marone, A.J. Piratelli, A.G. Franchin, L. Crispim, J. Benitez, Y. Benedetti","2023"
"khanShiftsDielActivity2023","Shifts in diel activity of Rocky Mountain mammal communities in response to anthropogenic disturbance and sympatric invasive white-tailed deer","P. Khan, L. Eliuk, S. Frey, C. Bone, J.T. Fisher","2023"
"everattOptimalForagingLions2023","Optimal foraging of lions at the human wildlands interface","K.T. Everatt, R. Kokes, H. Robinson, G.I.H. Kerley","2023"
"cooperFactorsAffectingRisk1997",""": Factors affecting risk and cost of escape by the broad-headed skink (Eumeces laticeps) Predator speed, directness of approach, and female presence","-","1997"
"mcgrathNorthernBobwhiteForaging2018","-","-","2018"
"goss-custardDisturbanceDoesNot2020",""": Disturbance does not have a significant impact on waders in an estuary close to conurbations importance of overlap between birds and people in time and space","-","2020"
"jordanEcologicalFactorsShape2022","-","-","2022"
"chitwoodEcologyFearUngulates2022","-","-","2022"
